[
  {
    "id": "CRANE-ISSUE-001",
    "title": "安全章节标题重复（防火安全重复出现）",
    "layer": "L2",
    "severity": "medium",
    "finding_type": "hard_evidence",
    "label_source_type": "doc_fact",
    "doc_supported": true,
    "gemini_supported": false,
    "manual_review_needed": false,
    "status": "seeded_unreviewed",
    "notes": "目录中第五节与第七节均为防火安全。"
  },
  {
    "id": "CRANE-ISSUE-002",
    "title": "危大工程专项方案计划缺失",
    "layer": "L1",
    "severity": "high",
    "finding_type": "engineering_inference",
    "label_source_type": "gemini_inference",
    "doc_supported": true,
    "gemini_supported": true,
    "manual_review_needed": true,
    "status": "seeded_unreviewed",
    "notes": "Gemini 明确指出起重吊装专项方案缺失；后续需结合规则引擎复核。"
  },
  {
    "id": "CRANE-ISSUE-003",
    "title": "煤气区域风险辨识不足",
    "layer": "L1",
    "severity": "high",
    "finding_type": "engineering_inference",
    "label_source_type": "gemini_inference",
    "doc_supported": true,
    "gemini_supported": true,
    "manual_review_needed": true,
    "status": "seeded_unreviewed",
    "notes": "原文确认煤气区域，Gemini 指出防毒/防窒息层面存在缺口。"
  },
  {
    "id": "CRANE-ISSUE-004",
    "title": "吊车站位承载力验算缺失",
    "layer": "L2",
    "severity": "medium",
    "finding_type": "engineering_inference",
    "label_source_type": "gemini_inference",
    "doc_supported": false,
    "gemini_supported": true,
    "manual_review_needed": true,
    "status": "seeded_unreviewed",
    "notes": "后续需结合专项方案及平面布置图进一步核验。"
  },
  {
    "id": "CRANE-ISSUE-005",
    "title": "应急预案标题与正文用途存在错配",
    "layer": "L1",
    "severity": "high",
    "finding_type": "hard_evidence",
    "label_source_type": "doc_fact",
    "doc_supported": true,
    "gemini_supported": true,
    "manual_review_needed": false,
    "status": "seeded_unreviewed",
    "notes": "当前文档中应急预案存在文题不符问题。"
  },
  {
    "id": "CRANE-ISSUE-006",
    "title": "附件已被引用但当前正文不可见",
    "layer": "L0",
    "severity": "info",
    "finding_type": "visibility_gap",
    "label_source_type": "visibility_assumption",
    "doc_supported": true,
    "gemini_supported": false,
    "manual_review_needed": true,
    "status": "seeded_unreviewed",
    "notes": "附件1/2 在目录出现，但当前 seed case 不含附件正文。"
  },
  {
    "id": "CRANE-ISSUE-007",
    "title": "工期基准存在双重表述",
    "layer": "L2",
    "severity": "medium",
    "finding_type": "hard_evidence",
    "label_source_type": "doc_fact",
    "doc_supported": true,
    "gemini_supported": true,
    "manual_review_needed": false,
    "status": "seeded_unreviewed",
    "notes": "固定开工日期与批准开工报告为准并存。"
  },
  {
    "id": "CRANE-ISSUE-008",
    "title": "成本管理计划缺失",
    "layer": "L2",
    "severity": "low",
    "finding_type": "suggestion_enhancement",
    "label_source_type": "gemini_inference",
    "doc_supported": false,
    "gemini_supported": true,
    "manual_review_needed": true,
    "status": "seeded_unreviewed",
    "notes": "来自 Gemini 深审结论，不视为已确认硬缺陷。"
  }
]
